,id,id_description,text
0,2570,1814," The patient failed to improve satisfactorily on conservative care, including anti-inflammatory medications and night splints."
1,75,77,The patient is having recurrent attacks of vertigo and imbalance over the last few years with periods of free symptoms and no concurrent tinnitus or hearing impairment.
2,2812,1966, The patient is having recurrent attacks of imbalance rather than true vertigo following the history of head trauma and loss of consciousness
3,656,669," Hypertension, depression, and chronic musculoskeletal pain of unclear etiology."
4,27,20," Atypical pneumonia, hypoxia, rheumatoid arthritis, and suspected mild stress-induced adrenal insufficiency"
5,795,826," Patient presented with significant muscle tremor, constant headaches, excessive nervousness, poor concentration, and poor ability to focus."
6,790,819, The patient continues to suffer from ongoing neck and lower back pain with no recent radicular complaints.
7,1397,1208," Severe menometrorrhagia unresponsive to medical therapy, anemia, and symptomatic fibroid uterus."
8,629,648, The patient has had abdominal pain associated with a 30-pound weight loss and then developed jaundice
9,2859,2058," The patient's subdural effusions are still noticeable, but they are improving."
10,1545,1286, The patient appears to have a significant pain requiring surgical evaluation
11,2045,1535," This patient has undergone cataract surgery, and vision is reduced in the operated eye due to presence of a secondary capsular membrane"
12,3237,2350," Patient suffers from neck and lower back pain radiating into both arms and both legs with numbness, paraesthesia, and tingling in both arms."
13,635,651, A critically ill 67-year-old with multiple medical problems probably still showing signs of volume depletion with hypotension and atrial flutter with difficult to control rate.
14,319,401, The patient has a history of epilepsy and has also had non-epileptic events in the past
15,2393,1699, The patient was unable to sustain enough caloric intake and had markedly decreased albumin stores
16,789,818, The patient has been suffering from intractable back and leg pain.
17,721,745, The patient has had increasing depression and has been under stress as a result of dissolution of her second marriage.
18,1907,1459," he patient is also ventilator-dependent, respiratory failure with tracheostomy in place and dependent on parenteral nutrition secondary to dysphagia and also has history of protein-calorie malnutrition and the patient needs to receive total parenteral nutrition and therefore needs central venous access."
19,34,26," Syncope, end-stage renal disease requiring hemodialysis, congestive heart failure, and hypertension."
20,54,46," Respiratory distress syndrome, intrauterine growth restriction, thrombocytopenia, hypoglycemia, retinal immaturity"
21,1436,1221," Protein-calorie malnutrition, intractable nausea, vomiting, and dysphagia, and enterogastritis."
22,1286,1150," Hyperpyrexia/leukocytosis, ventilator-dependent respiratory failure, and acute pancreatitis."
23,2360,1680, Obstructive adenotonsillar hypertrophy with chronic recurrent pharyngitis.
24,871,883, The patient will receive intensity-modulated radiation therapy in order to deliver high-dose treatment to sensitive structures
25,786,816, This patient is to undergo a course of hyperfractionated radiotherapy in the treatment of known malignancy
26,725,750, Patient has a past history of known hyperthyroidism and a recent history of atrial fibrillation and congestive cardiac failure with an ejection fraction of 20%-25%.
27,2617,1839,  The patient is a 65-year-old male with known moderate mitral regurgitation with partial flail of the P2 and P3 gallops who underwent outpatient evaluation for increasingly severed decreased functional capacity and retrosternal chest pain that was aggravated by exertion and decreased with rest.
28,31,24," Severe menometrorrhagia unresponsive to medical therapy, severe anemia, and fibroid uterus."
29,571,592," Cardiac arrest, severe congestive heart failure, acute on chronic respiratory failure, osteoporosis, and depression."
30,1010,979, The patient is a 9-year-old Caucasian male with history of recurrent episodes of adenotonsillitis that has been refractory to outpatient antibiotic therapy
31,3028,2186,  Congestive heart failure due to rapid atrial fibrillation and systolic dysfunction.
32,744,777, The patient is a 4-month-old who presented with supraventricular tachycardia and persistent cyanosis.
33,33,25," Severe menometrorrhagia unresponsive to medical therapy, severe anemia, and symptomatic fibroid uterus"
34,2921,2108," Hyperlipidemia, chronic renal insufficiency, and arthritis."
35,245,344," Chronic lymphocytic leukemia (CLL), autoimmune hemolytic anemia, and oral ulcer"
36,13,6, This patient is undergoing 3-dimensionally planned radiation therapy in order to adequately target structures at risk while diminishing the degree of exposure to uninvolved adjacent normal structures.
37,2523,1771," Chest pain secondary to fractured ribs, unmanageable with narcotics."
38,1278,1146," Hematochezia, refractory dyspepsia, colonic polyps at 35 cm and 15 cm, diverticulosis coli, and acute and chronic gastritis.
"
39,155,176, The patient had bilateral nephrostomy tubes placed one month ago secondary to his prostate cancer metastasizing and causing bilateral ureteral obstructions that were severe enough to cause acute renal failure.
40,2697,1882, Massive intraventricular hemorrhage with hydrocephalus and increased intracranial pressure.
41,538,557, The patient has a history of malrotation.
42,3091,2243," The patient has been successful with weight loss due to assistance from others in keeping a food diary, picking lower-calorie items, her three-meal pattern, getting a balanced diet, and all her physical activity."
43,1964,1487,The patient is a 52-year-old female morbidly obese black female who has a long history of reflux and GERD type symptoms including complications such as hoarseness and chronic cough.
44,843,863," Cardiac Catheterization - An obese female with a family history of coronary disease and history of chest radiation for Hodgkin disease, presents with an acute myocardial infarction with elevated enzymes."
45,1323,1171," Maxillary atrophy, severe mandibular atrophy, acquired facial deformity, and masticatory dysfunction."
46,23,16," Hyperglycemia, cholelithiasis, obstructive sleep apnea, diabetes mellitus, hypertension, and cholecystitis."
47,883,892, Normal LV function and low likelihood of significant epicardial coronary narrowing.
48,2605,1833, This is an 87-year-old Caucasian female with critical aortic stenosis with an aortic valve area of 0.5 cm square and recurrent congestive heart failure symptoms mostly refractory to tachybrady arrhythmias
49,46,37, Patient suffered from morbid obesity for many years and made multiple attempts at nonsurgical weight loss without success
50,812,846," Colonoscopy due to rectal bleeding, constipation, abnormal CT scan, rule out inflammatory bowel disease."
51,660,677," The patient is a 60-year-old female patient who off and on for the past 10 to 12 months has had almost daily diarrhea, nausea, inability to eat"
52,706,722," Patient has a history of chronic back pain, dating back to an accident that he states he suffered two years ago."
53,749,783, The patient is admitted with a diagnosis of acute on chronic renal insufficiency.
54,1932,1473, The patient is a 35-year-old female with a history of a chronic pharyngitis and obstructive adenotonsillar hypertrophy
55,279,364, The patient is developing gestational diabetes.
56,1089,1028, Residual adenoid hypertrophy and recurrent epistaxis.
57,1882,1448," The patient had thyroid cancer, papillary cell type, removed with a total thyroidectomy and then subsequently recurrent disease was removed with a paratracheal dissection."
58,1,0," This is a 75-year-old female who presents with difficulty swallowing, occasional choking, and odynophagia"
59,1220,1114,   The patient is a 1-year-old male with a history of chronic otitis media with effusion and conductive hearing loss refractory to outpatient medical therapy
60,1835,1424," Severe degenerative changes within the femoral head as well as the acetabulum, anterior as well as posterior osteophytes"
61,1193,1101," Acute pain, fever postoperatively, hemostatic uterine perforation, no bowel or vascular trauma."
62,1358,1187," Patient has tried conservative methods such as wide shoes and serial debridement and accommodative padding, all of which provided inadequate relief"
63,2505,1757, Laparoscopic cholecystectomy due to chronic cholecystitis and cholelithiasis.
64,2083,1555," The patient had the appropriate inflammatory workup for pericardial effusion, however, it was nondiagnostic."
65,624,644," Psychiatric consultation has been requested as the patient has been noncompliant with treatment, leave the unit, does not return when requested, and it was unclear as to whether this is secondary to confusion or willful behavior."
66,1238,1126," Surgically, the patient has an enlarged fibroid uterus with a large fundal/anterior fibroids."
67,747,781," The patient with longstanding bilateral arm pain, which is predominantly in the medial aspect of arms and hands, as well as left hand numbness, worse at night and after doing repetitive work with left hand."
68,290,375, This patient is undergoing a conformal simulation as the method to precisely define the area of disease which needs to be treated
69,1721,1367, The patient is a 72-year-old female with a history of bilateral knee pain for years progressively worse and decreasing quality of life and ADLs.
70,362,423, Patient presented with symptoms of pneumonia and developed rapid sepsis and respiratory failure requiring intubation.
71,759,790, The patient has a history of back and buttock pain for some time
72,1281,1148," Enlarged fibroid uterus, infertility, pelvic pain, and probable bilateral tubal occlusion"
73,564,586," Low back pain, lumbar radiculopathy, degenerative disc disease, lumbar spinal stenosis, history of anemia, high cholesterol, and hypothyroidism."
74,1222,1115," Chronic pelvic inflammatory disease, pelvic adhesions, pelvic pain, fibroid uterus, and enterocele."
75,1218,1113, Chronic nasal obstruction secondary to deviated nasal septum and inferior turbinate hypertrophy.
76,2157,1585," CT imaging reveals an acute left subdural hematoma, which is hemispheric."
77,2039,1532," The patient is a middle-aged female, who has had significant lacerations to her head from a motor vehicle accident"
78,2838,2003," Acute renal failure, probable renal vein thrombosis, hypercoagulable state, and deep venous thromboses with pulmonary embolism."
79,3096,2249," A 46-year-old white male with Down’s syndrome presents for followup of hypothyroidism, as well as onychomycosis."
80,804,842, No evidence of exercise induced ischemia at a high myocardial workload
81,872,884, Intensity-modulated radiation therapy is a complex set of procedures which requires appropriate positioning and immobilization typically with customized immobilization devices.
82,2945,2128," He has some occasional headaches and tinnitus, but his vision is much improved."
83,193,232, The patient is a 40-year-old female with a past medical history of repair of deviated septum with complication of a septal perforation
84,3030,2188," Atrial fibrillation with rapid ventricular response, Wolff-Parkinson White Syndrome, recent aortic valve replacement with bioprosthetic Medtronic valve, and hyperlipidemia."
85,2345,1671,"  Meniscal tear, osteochondral lesion, degenerative joint disease, and chondromalacia,"
86,2742,1907," Acute cholecystitis, status post laparoscopic cholecystectomy, end-stage renal disease on hemodialysis, hyperlipidemia, hypertension, congestive heart failure, skin lymphoma 5 years ago, and hypothyroidism."
87,3062,2215," Multiple problems including left leg swelling, history of leukocytosis, joint pain left shoulder, low back pain, obesity, frequency with urination, and tobacco abuse."
88,731,763, This patient may have had reactive arthritis
89,1742,1376, Atrophic laryngeal changes secondary to inhaled steroid use.
90,2194,1604, The patient states she has had a bunion deformity for as long as she can remember that has progressively become worse and more painful.
91,1573,1297, Adenotonsillar hypertrophy and chronic otitis media
92,3071,2227," Pulmonary disorder with lung mass, pleural effusion, and chronic uncontrolled atrial fibrillation secondary to pulmonary disorder"
93,3180,2310, The patient is a 22-year-old woman with a possible ruptured ectopic pregnancy.
94,669,686," Right knee injury suggestive of a recurrent anterior cruciate ligament tear, possible internal derangement"
95,623,643," Comprehensive annual health maintenance examination, dyslipidemia, tinnitus in left ear, and hemorrhoids."
96,2844,2012, The patient is a 53-year-old female with probable pathological fracture of the left proximal femur.
97,2849,2023," Possible ischemic cecum with possible metastatic disease, bilateral hydronephrosis on atrial fibrillation, aspiration pneumonia, chronic alcohol abuse, acute renal failure, COPD, anemia with gastric ulcer."
98,687,707," Chronic kidney disease, stage IV, secondary to polycystic kidney disease"
99,1264,1139," Gastroesophageal reflux disease, hiatal hernia, and enterogastritis."
100,2854,2045, The patient is noted to have an increase in her liver function tests on routine blood work
101,1773,1390, The patient is a 58-year-old female with poorly controlled diabetes with severe lower extremity lymphedema
102,373,428, Chronic obstructive pulmonary disease (COPD) exacerbation and acute bronchitis.
103,196,236," Posttransplant lymphoproliferative disorder, chronic renal insufficiency, squamous cell carcinoma of the skin, anemia secondary to chronic renal insufficiency and chemotherapy, and hypertension"
104,2923,2109," Physical examination and radiographic findings are compatible with left shoulder pain and left upper extremity pain, which is due to a combination of left-sided rotator cuff tear and moderate cervical spinal stenosis."
105,1695,1355, Chronic tonsillitis with symptomatic tonsil and adenoid hypertrophy
106,1625,1323," The patient had a workup for her gallbladder, which showed evidence of biliary dyskinesia."
107,1696,1356," Chronic venous hypertension with painful varicosities, lower extremities, bilaterally"
108,3212,2328," Patient has had biliary colic-type symptoms for the past 3-1/2 weeks, characterized by severe pain, and brought on by eating greasy foods."
109,1355,1186," Pelvic pain, hypermenorrhea, and mild pelvic endometriosis."
110,2177,1595,"  Bilateral axillary masses, rule out recurrent Hodgkin's disease."
111,3154,2294, Multinodular thyroid goiter with compressive symptoms and bilateral dominant thyroid nodules proven to be benign by fine needle aspiration.
112,923,921, Recurrent angina pectoris in a patient with documented ischemic heart disease and underlying ischemic cardiomyopathy.
113,2312,1658, The patient was found to have a left inguinal hernia increasing over the past several months
114,3174,2305,  The patient is a 17-year-old girl who presented with headaches and was found to have a prolactin of 200 and pituitary tumor.
115,1512,1270," Right ureteropelvic junction obstruction, severe intraabdominal adhesions, and retroperitoneal fibrosis."
116,2112,1567," The patient was found to have a visually-significant cataract and, after discussion of the risks, benefits and alternatives to surgery, she elected to proceed with cataract extraction and lens implantation in this eye in efforts to improve her vision."
117,2196,1605, The patient is a 62-year-old female who presents with neck pain as well as upper extremity symptoms
118,2538,1789," Refractory hypertension, much improved, history of cardiac arrhythmia and history of pacemaker secondary to AV block, history of GI bleed, and history of depression."
119,1609,1315, 3-1/2-year-old presents with bilateral scrotal swellings consistent with bilateral inguinal hernias.
120,777,809," Patient with a diagnosis of pancreatitis, developed hypotension and possible sepsis and respiratory, as well as renal failure."
121,2969,2146," The patient denies fever, fatigue, weakness, weight gain or weight loss."
122,56,49," Fever, otitis media, and possible sepsis."
123,764,794," Chronic glossitis, xerostomia, probable environmental inhalant allergies, probable food allergies, and history of asthma."
124,3054,2209," Degenerative disk disease of the right hip, low back pain with lumbar scoliosis post laminectomy syndrome, lumbar spinal stenosis, facet and sacroiliac joint syndrome, and post left hip arthroplasty."
125,754,786," A ight-handed inpatient with longstanding history of cervical spinal stenosis status post decompression, opioid dependence, who has had longstanding low back pain radiating into the right leg."
126,2528,1773, The patient presents with lower extremity claudication
127,579,597," Tilt table test is negative for any evidence of vasovagal, orthostasis or vasodepressor syndrome."
128,858,873, The patient is also complaining of dizziness.
129,931,924, Mild-to-moderate obstructive ventilatory impairment
130,168,198," Chronic eustachian tube dysfunction, chronic otitis media with effusion, recurrent acute otitis media, adenoid hypertrophy."
131,1774,1390, The patient has history of previous right foot infection requiring first ray resection.
132,25,18,"  Menometrorrhagia, dysmenorrhea, and small uterine fibroids."
133,246,344, The patient was diagnosed with chronic lymphocytic leukemia and was noted to have autoimmune hemolytic anemia at the time of his CLL diagnosis.
134,705,722, Lumbar muscle strain and chronic back pain
135,1688,1352,"  Chronic pelvic pain, probably secondary to endometriosis."
136,29,22," Pyelonephritis likely secondary to mucous plugging of indwelling Foley in the ileal conduit, hypertension, mild renal insufficiency, and anemia, which has been present chronically over the past year."
137,1225,1117," Chronic pelvic pain, endometriosis, prior right salpingo-oophorectomy, history of intrauterine device perforation and exploratory surgery."
138,1335,1178, Neuromuscular dysphagia
139,361,423, Disseminated intravascular coagulation and Streptococcal pneumonia with sepsis
140,1549,1287, The patient's gallbladder had some patchy and necrosis areas
141,1338,1179, Intercostal nerve block for postoperative pain relief at five levels.
142,2740,1906, No evidence of inflammation or narrowing to explain her symptoms.
143,2213,1612," Exploratory laparotomy, radical hysterectomy, bilateral ovarian transposition, pelvic and obturator lymphadenectomy."
144,2279,1640, The patient has had previous I&D but continues to have to purulent drainage
145,2907,2088," She has been having multiple cardiovascular complaints including chest pains, which feel like cramps and sometimes like a dull ache, which will last all day long."
146,1432,1219, Ventilator-dependent respiratory failure and laryngeal edema.
147,1316,1169, Lumbar osteomyelitis and need for durable central intravenous access
148,3020,2180," The patient is starting to improve, gain more strength"
149,718,739, Recurrent urinary tract infection in a patient recently noted for another Escherichia coli urinary tract infection.
150,992,966," Patient with end-stage renal disease secondary to hypertension, a reasonable candidate for a kidney transplantation."
151,1214,1112," Chronic cholecystitis, cholelithiasis, and liver cyst"
152,184,223, The patient reports swelling in his left submandibular region that occurred all of a sudden about a month and a half ago
153,1988,1503," The patient is a 51-year-old male with left Dupuytren disease, which is causing contractions both at the metacarpophalangeal and the PIP joint as well as significant discomfort."
154,2841,2009, MRI of the brain shows large inhomogeneous infiltrating right frontotemporal neoplasm surrounding the right middle cerebral artery.
155,2846,2015, Patient  had a diagnosis of multilobar pneumonia along with arrhythmia and heart failure as well as renal insufficiency
156,222,271, Short-term memory loss (probable situational) and anxiety stress issues.
157,1838,1425, He has had an elevated PSA and also has erectile dysfunction
158,3075,2228," Short-term followup - Hypertension, depression, osteoporosis, and osteoarthritis."
159,2507,1758, Hemoptysis and history of lung cancer
160,1383,1202, Chronic obstructive pulmonary disease
161,3053,2208," Low back pain, lumbar degenerative disc disease, lumbar spondylosis, facet and sacroiliac joint syndrome, lumbar spinal stenosis primarily bilateral recess, intermittent lower extremity radiculopathy, DJD of both knees, bilateral pes anserinus bursitis, and chronic pain syndrome."
162,2417,1709, The patient is a 41-year-old female with abnormal mammogram with a strong family history of breast cancer requesting needle-localized breast biopsy for nonpalpable breast mass.
163,2904,2085," The patient had several episodes where she felt like her face was going to twitch, which she could suppress it with grimacing movements of her mouth and face."
164,1618,1319, Bilateral conductive hearing losses with right stapedial fixation secondary to otosclerosis.
165,215,259," The patient does have a history of alcohol abuse, but mostly he is concerned about the heroin abuse."
166,2428,1712, This is a 54-year-old female who was complaining of right hand numbness and tingling of the median distribution and has elected to undergo carpal tunnel surgery secondary to failure of conservative management.
167,160,188,  This is a 40-year-old male with digoxin toxicity secondary to likely intentional digoxin overuse
168,1140,1064," Cystoscopy under anesthesia, retrograde and antegrade pyeloureteroscopy, left ureteropelvic junction obstruction, difficult and open renal biopsy."
169,2657,1859, No evidence of polyps or malignancy.
170,2082,1555, Symptomatic pericardial effusion
171,1239,1127," Enlarged fibroid uterus, hypermenorrhea, and secondary anemia"
172,1019,988," Due to the comminuted nature of her tibia fracture as well as soft tissue swelling, the patient is in need of a staged surgery with the 1st stage external fixation followed by open treatment and definitive plate and screw fixation"
173,286,367, The patient has aortic stenosis.
174,1017,987," Contusion of the frontal lobe of the brain, closed head injury and history of fall, and headache, probably secondary to contusion."
175,3226,2341, The patient had tympanoplasty surgery for a traumatic perforation of the right ear about six weeks ago
176,1706,1360, The patient is a 62-year-old white male who presents to the office with a history of colon polyps and need for recheck.
177,2782,1938," Patient with active flare of Inflammatory Bowel Disease, not responsive to conventional therapy including sulfasalazine, cortisone, local therapy."
178,388,442," The patient did receive skilled speech therapy while in the acute rehab, which focused on higher level cognitive and linguistic skills such as attention, memory, mental flexibility, and improvement of her executive function"
179,3235,2348, She has chronic lung disease with bronchospastic angina.
180,1142,1065, Malnutrition and dysphagia with two antral polyps and large hiatal hernia.
181,647,660," A 50-year-old female whose 51-year-old sister has a history of multiple colon polyps, which may slightly increase her risk for colon cancer in the future."
182,2247,1628, He has had multiple severe carious lesions that warrant multiple extractions at this time.
183,2533,1779,"  Esophageal foreign body, no associated comorbidities are noted."
184,1966,1489, A 14-year-old young lady is in the renal failure and in need of dialysis.
185,2871,2065, Coronary artery bypass surgery and aortic stenosis
186,832,855," Reduced exercise capacity for age, no chest pain with exercise, no significant ST segment changes with exercise, symptoms of left anterior chest pain were not provoked with exercise, and hypertensive response noted with exercise."
187,681,702," A 61-year-old woman with a history of polyarteritis nodosa, mononeuritis multiplex involving the lower extremities, and severe sleep apnea returns in followup following an overnight sleep study."
188,1213,1111,  Chronic adenotonsillitis and ankyloglossia.
189,296,381," Generalized abdominal pain, nausea, diarrhea, and recent colonic resection"
190,1513,1271, Right pterional craniotomy with obliteration of medial temporal arteriovenous malformation and associated aneurysm and evacuation of frontotemporal intracerebral hematoma.
191,186,226, The patient is an 83-year-old female with a history of polycythemia vera
192,672,687," An 84-year-old woman with a history of hypertension, severe tricuspid regurgitation with mild pulmonary hypertension, mild aortic stenosis, and previously moderate mitral regurgitation."
193,1434,1220, Ventilator-dependent respiratory failure and multiple strokes.
194,3074,2227," The patient has chronic atrial fibrillation, on anticoagulation"
195,3177,2307," The patient is a 26-year-old female with a long history of shunt and hydrocephalus presenting with a draining wound in the right upper quadrant, just below the costal margin that was lanced by General Surgery and resolved; however, it continued to drain."
196,1379,1201," Right hydronephrosis, right flank pain, atypical/dysplastic urine cytology, extrarenal pelvis on the right, no evidence of obstruction or ureteral/bladder lesions"
197,3162,2298, This premature baby with operative weight of 600 grams and evidence of persistent pulmonary over circulation and failure to thrive has been diagnosed with a large patent ductus arteriosus originating in the left-sided aortic arch
198,1704,1360, Universal diverticulosis and nonsurgical internal hemorrhoids
