,id,id_description,text
199,1152,1072," Progressive exertional angina, three-vessel coronary artery disease, left main disease, preserved left ventricular function."
200,736,769, Neurologic consultation was requested to assess and assist with seizure medication.
201,3002,2172, Obsessive compulsive disorder.
202,11,5," Normal left ventricle, moderate biatrial enlargement, and mild tricuspid regurgitation, but only mild increase in right heart pressures."
203,1634,1326, He presents today with diarrhea and bleeding.
204,92,94,"vascular injury to the left substantia nigra, right subdural hematoma and possible subarachnoid hemorrhage, vascular/ischemic injury in the right occipital lobe-right basal ganglia/caudate nucleus-right frontal lobe, and right temporal lobe contusion."
205,1194,1102, Benign prostatic hypertrophy and urinary retention
206,1529,1278,  Submucosal hemorrhage consistent with trauma from vomiting and grade 2 esophagitis
207,413,466, The patient is a 52-year-old male who has had a very complex course secondary to a right lower extremity complex open wound
208,1012,980," Mild tracheobronchitis with history of granulomatous disease and TB, rule out active TB/miliary TB."
209,1843,1426," Upon examination in the office, the patient was found to have a left inguinal hernia consistent with tear, which was scheduled as an outpatient surgery."
210,2985,2159, The patient presents for evaluation at the request of his primary physician for treatment for dystrophic nails
211,3239,2352," He continues to have abdominal pain, and he had a diuretic renal scan, which indicates no evidence of obstruction and good differential function bilaterally"
212,1735,1374," Exploratory laparotomy, total abdominal hysterectomy, bilateral salpingo-oophorectomy, right and left pelvic lymphadenectomy, common iliac lymphadenectomy, and endometrial cancer staging procedure."
213,2666,1864, The patient is a 52-year-old male with metastatic osteogenic sarcoma
214,252,347, She was found to have disease progression first noted by rising tumor markers.
215,1404,1209, Clots partially obstructing the endotracheal tube and completely obstructing the entire left main stem and entire left bronchial system.
216,2559,1808, Severe nonischemic cardiomyopathy with prior ventricular tachycardia.
217,1262,1138," Gastroesophageal reflux disease, chronic dyspepsia, alkaline reflux gastritis, gastroparesis, probable Billroth II anastomosis, and status post Whipple's pancreaticoduodenectomy."
218,1369,1193, Recurrent bladder tumor and history of bladder carcinoma.
219,38,31, Microinvasive carcinoma of the cervix.
220,2981,2155, This patient has reoccurring ingrown infected toenails.
221,2313,1658, The patient has a history of multiple abdominal surgeries and opted for an open left inguinal hernial repair with Prolene mesh.
222,985,960," The patient with recurrent nongranulomatous anterior iritis and most recently, pain in  left eye associated with headache and photophobia."
223,723,746," Mild organic brain syndrome, presumably secondary to her chronic inhalant, paint, abuse."
224,1284,1149," Hypermenorrhea, uterine fibroids, pelvic pain, left adnexal mass, and pelvic adhesions."
225,1072,1019, Metastatic carcinoma of the bladder and bowel obstruction.
226,159,188," Anxiety, alcohol abuse, and chest pain"
227,1147,1069, The patient fell following an episode of syncope and sustained a blunt trauma to his ribs resulting in multiple fractures and presumably also struck his mandible resulting in fracture
228,626,646," Persistent frequency and urgency, in a patient with a history of neurogenic bladder and history of stroke"
229,2037,1531," Spinal Manipulation under Anesthesia - Sacro-iliitis, lumbo-sacral segmental dysfunction, thoraco-lumbar segmental dysfunction, associated with myalgia/fibromyositis."
230,1427,1217, Urinary retention and benign prostate hypertrophy
231,684,704, She does have degenerative disk disease of her lumbar spine but no hip pathology
232,2273,1637," On CT scan evaluation, there is evidence of an entrapped right lower lobe with loculations."
233,2961,2143," A woman with a history of progression of dysphagia for the past year, dysarthria, weakness of her right arm, cramps in her legs, and now with progressive weakness in her upper extremities"
234,174,211," The patient is a 57-year-old female with invasive ductal carcinoma of the left breast, T1c, Nx, M0 left breast carcinoma."
235,2858,2058, The patient is a 79-year-old man with adult hydrocephalus who was found to have large bilateral effusions on a CT scan
236,1280,1147," Hoarseness, bilateral true vocal cord lesions, and leukoplakia."
237,51,41, Gastrointestinal bleed and chronic inflammation of the mesentery of unknown etiology.
238,239,303," The patient comes for three-week postpartum checkup, complaining of allergies."
239,665,682, The patient is a 65-year-old female who underwent left upper lobectomy for stage IA non-small cell lung cancer
240,2808,1959," Robotic-assisted pyeloplasty, anterograde right ureteral stent placement, transposition of anterior crossing vessels on the right, and nephrolithotomy."
241,3018,2180, The patient has required conversion to an open procedure due to difficult anatomy
242,2571,1815, Small internal hemorrhoids and Ileal colonic anastomosis.
243,2888,2071, Echodensity involving the aortic valve suggestive of endocarditis and vegetation
244,477,518," Chest pain, coronary artery disease, prior bypass surgery"
245,381,435, Cognitive linguistic impairment secondary to stroke
246,2543,1796," Nonischemic cardiomyopathy, branch vessel coronary artery disease, congestive heart failure - NYHA Class III, history of nonsustained ventricular tachycardia, hypertension, and hepatitis C."
247,2973,2148," There is no blurring of the vision, itching, throat or neck pain, or neck fullness"
248,2373,1687," Laparoscopically, the patient has large omental to anterior abdominal wall adhesions along the left side of the abdomen extending down to the left adnexa"
249,2469,1738," The patient is a 71-year-old black female who had a routine mammogram, which demonstrated suspicious microcalcifications in the left breast"
250,728,760," The patient is a 76-year-old male, with previous history of dysphagia, status post stroke"
251,3187,2315, Squamous cell carcinoma of the larynx
252,322,403, The patient progressed to a normal spontaneous vaginal delivery over an intact perineum.
253,283,366, The exercise myocardial perfusion study shows possibility of mild ischemia in the inferolateral wall and normal LV systolic function with LV ejection fraction of 59%
254,2766,1922, The patient is a newborn with diagnosis of hypoplastic left heart syndrome who 48 hours prior to the current procedure has undergone a modified stage 1 Norwood operation.
255,577,595,"  At the time of discharge, the patient had improved."
256,2487,1746, Worrisome skin lesion
257,2396,1700, Recurrent right upper quadrant pain with failure of antacid medical therapy
258,3031,2189," Rhabdomyolysis, acute on chronic renal failure, anemia, leukocytosis, elevated liver enzyme, hypertension, elevated cardiac enzyme, obesity."
259,1455,1236, A female with a history of severe dysmenorrhea and menorrhagia unimproved with medical management.
260,26,19, The patient underwent a total vaginal hysterectomy.
261,2123,1571, Degenerative arthritis of the left knee
262,2389,1697, Radical retropubic prostatectomy with pelvic lymph node dissection due to prostate cancer.
263,1042,1005, A 50% distal left main and two-vessel coronary artery disease with normal left ventricular systolic function
264,1693,1354, The patient was discovered to have a MRSA bacteremia with elevated fever and had tenderness at the anterior chest wall where his Perm-A-Cath was situated.
265,101,108, MRI Brain - Progressive Multifocal Leukoencephalopathy (PML) occurring in an immunosuppressed patient with polymyositis.
266,3126,2277, Past ocular history includes cataract extraction with lens implants in both eyes.
267,631,648," A thin-slice CT scan was performed, which revealed a pancreatic mass with involved lymph nodes and ring enhancing lesions consistent with liver metastases"
268,885,893, The patient was admitted for skilled speech therapy secondary to cognitive-linguistic deficits
269,266,358, An abnormal chest radiograph shows right middle lobe infiltrate and collapse
270,1353,1185," Pelvic pain, ectopic pregnancy, and hemoperitoneum."
271,49,39," A 49-year-old man with respiratory distress, history of coronary artery disease with prior myocardial infarctions, and recently admitted with pneumonia and respiratory failure."
272,2050,1537, Severe degenerative joint disease of the right shoulder.
273,1127,1056, Sigmoid diverticulosis and internal hemorrhoids.
274,3240,2353, The patient is being referred for evaluation of diabetic retinopathy.
275,2502,1755," Exploratory laparotomy, release of small bowel obstruction, and repair of periumbilical hernia"
276,797,837," EEG during wakefulness, drowsiness, and sleep with synchronous video monitoring demonstrated no evidence of focal or epileptogenic activity."
277,798,838," Abnormal electroencephalogram revealing generalized poorly organized slowing, with more prominent slowing noted at the right compared to the left hemisphere head regions and rare sharp wave activity noted bilaterally, somewhat more prevalent on the right"
278,370,427, Adrenal insufficiency
279,1462,1242," Direct laryngoscopy, rigid bronchoscopy and dilation of subglottic upper tracheal stenosis."
280,2704,1888," Sinus bradycardia, sick-sinus syndrome, poor threshold on the ventricular lead and chronic lead"
281,2325,1664, The patient subjectively had loss of consciousness on the scene and minimal bleeding from the left supraorbital laceration site.
282,1526,1276," Urinary hesitancy and weak stream, urethral narrowing, mild posterior wall erythema."
283,1528,1278, Hematemesis in a patient with longstanding diabetes
284,124,134, MRI - Arteriovenous malformation with hemorrhage.
285,3080,2231, The patient is in complaining of headaches and dizzy spells.
286,2918,2108, Followup evaluation and management of chronic medical conditions
287,2899,2079, Cervical spondylosis and kyphotic deformity
288,180,218, She sustained a concussion with postconcussive symptoms and syndrome that has resolved
289,2472,1739, Unilateral transpedicular T11 vertebroplasty.
290,194,232," At this time, the patient states that her septal perforation bothers her as she feels that she has very dry air through her nose as well as occasional epistaxis."
291,3143,2290, Video EEG monitoring is performed to capture events and/or identify etiology.
292,569,591," Delivered pregnancy, cholestasis of pregnancy, fetal intolerance to labor, failure to progress"
293,3169,2302," The patient is a 49-year-old gentleman with leukemia and meningeal involvement, who was undergoing intrathecal chemotherapy"
294,1085,1027," Bilateral myringotomies, placement of ventilating tubes, nasal endoscopy, and adenoidectomy."
295,247,345, Extensive stage small cell lung cancer
296,3130,2281, The patient was admitted approximately 3 days ago with increasing shortness of breath secondary to pneumonia
297,3035,2192," Numbness and tingling in the right upper extremity, intermittent and related to the positioning of the wrist"
298,117,126, Cerebral Angiogram - Lobulated aneurysm of the supraclinoid portion of the left internal carotid artery close to the origin of the left posterior communicating artery.
299,739,773," Pulmonary valve stenosis, supple pulmonic narrowing, and static encephalopathy"
300,1237,1126," On bimanual exam, the patient has an enlarged, approximately 14-week sized uterus that is freely mobile and anteverted with no adnexal masses"
301,1003,976, Adenotonsillitis with hypertrophy
302,1610,1316, Bilateral knee degenerative arthritis
303,2064,1546, The patient is a 51-year-old female with complaints of soft tissue mass over the dorsum of the right foot.
304,3184,2313, She came in with severe traumatic brain injury and severe multiple fractures of the right side of the skull
305,2983,2157, A 60-year-old female presents today for care of painful calluses and benign lesions.
306,409,462, The patient is being discharged for continued hemodialysis and rehab.
307,71,73, The patient is recently postoperative
308,1365,1191," A diabetic male in urinary retention with apparent neurogenic bladder and intermittent self-catheterization, recent urinary tract infections"
309,2010,1512, Right pleural effusion and suspected malignant mesothelioma.
310,2656,1859, There is no family history of colon cancer
311,1372,1197," Right axillary adenopathy, thrombocytopenia, and hepatosplenomegaly"
312,2275,1638, End-stage renal disease with need for a long-term hemodialysis access
313,722,746," Bipolar disorder, apparently stable on medications"
314,765,795," A 69-year-old female with past history of type II diabetes, atherosclerotic heart disease, hypertension, carotid stenosis"
315,750,784, The patient was referred to Medical Center's Outpatient Rehabilitation Department for skilled speech therapy to improve her functional communication skills and swallowing function and safety.
316,2146,1580,  A CT scan of abdomen showed evidence of appendicitis with perforation
317,1708,1361, Colovesical fistula and intraperitoneal abscess.
318,255,348, The patient is a 47-year-old female who was noted to have abnormal vaginal bleeding in the fall of 2009
319,1945,1479," Cystoscopy, TUR, and electrofulguration of recurrent bladder tumors."
320,1170,1086, Cervical spondylotic myelopathy with cord compression and cervical spondylosis.
321,2189,1601," Bladder lesions with history of previous transitional cell bladder carcinoma, pathology pending."
322,1991,1504, This is a 54-year-old female with a newly diagnosed carcinoma of the cervix
323,617,637," A 67-year-old male with COPD and history of bronchospasm, who presents with a 3-day history of increased cough, respiratory secretions, wheezings, and shortness of breath."
324,1684,1349," Patient with increasingly severe more frequent right upper quadrant abdominal pain, more after meals, had a positive ultrasound for significant biliary sludge."
325,1930,1473, Postoperative hemorrhage
326,269,359, Sarcomatoid carcinoma with areas of pleomorphic/giant cell carcinoma and spindle cell carcinoma
327,1637,1328, The patient is an 85-year-old female who was admitted to the hospital with a markedly decreased hemoglobin and blood loss anemia
328,572,593, Gastroenteritis and autism
329,618,638, The patient comes in today because of feeling lightheaded and difficulty keeping his balance.
330,2237,1625," Bifrontal cranioplasty, cranial defect greater than 10 cm in diameter in the frontal region."
331,3156,2296, Central neck reoperation with removal of residual metastatic lymphadenopathy and thyroid tissue in the central neck
332,1074,1020, Nasal septal deviation with bilateral inferior turbinate hypertrophy
333,515,546, Transthoracic echocardiogram was performed of adequate technical quality
334,378,433, Bilateral transaxillary subpectoral mammoplasty with saline-filled implants.
335,803,842," Elevated cardiac enzymes, fullness in chest, abnormal EKG, and risk factors"
336,320,401, Video EEG monitoring is performed to assess whether it is epileptic seizures or non-epileptic events.
337,2826,1977, A female with a history of peritoneal mesothelioma who has received prior intravenous chemotherapy
338,2442,1721, CT-guided frameless stereotactic radiosurgery for the right occipital arteriovenous malformation using dynamic tracking.
339,1227,1119, Chronic renal failure and thrombosed left forearm arteriovenous Gore-Tex bridge fistula.
340,732,765, Acute supraglottitis with airway obstruction and parapharyngeal cellulitis and peritonsillar cellulitis.
341,2913,2102," The patient with pseudotumor cerebri without papilledema, comes in because of new onset of headaches"
342,351,417, Acute bronchitis with reactive airway disease.
343,1291,1154," Intrauterine pregnancy at 37 plus weeks, nonreassuring fetal heart rate."
344,3019,2180," Her postoperative course has been lengthened due to a prolonged ileus, which resolved with tetracycline and Reglan"
345,2388,1696, Open radical retropubic prostatectomy with bilateral lymph node dissection.
346,607,625," Negative weakness, negative fatigue, native malaise, negative chills, negative fever, negative night sweats, negative allergies."
347,2971,2147," Negative weakness, negative fatigue, native malaise, negative chills, negative fever, negative night sweats, negative allergies."
348,1449,1234, Aortobifemoral bypass surgery utilizing a bifurcated Hemashield graft.
349,2663,1863, Intermittent rectal bleeding with abdominal pain.
350,1474,1248, Ultrasound showed metastasis to be high in the left inguinal canal
351,177,212," Possible nerve injuries to the radial and median nerve, possibly neurapraxia."
352,610,628, The right upper lobe wedge biopsy shows a poorly differentiated non-small cell carcinoma with a solid growth pattern and without definite glandular differentiation by light microscopy.
353,1180,1095, Colonoscopy in a patient with prior history of anemia and abdominal bloating.
354,1108,1042," Left ear cartilage graft, repair of nasal vestibular stenosis using an ear cartilage graft, cosmetic rhinoplasty, left inferior turbinectomy."
355,1393,1205, Degenerative joint disease.
356,2788,1945, Percutaneous intervention with drug-eluting stent placement to the ostium of the PDA.
357,842,862, Bronchoscopy for persistent cough productive of sputum requiring repeated courses of oral antibiotics over the last six weeks in a patient who is a recipient of a bone marrow transplant with end-stage chemotherapy and radiation-induced pulmonary fibrosis.
358,839,860," She is a 14-year-old Hispanic female with history of pauciarticular arthritis in particular arthritis of her left knee, although she has complaints of arthralgias in multiple joints"
359,642,658, Patient is a 14-year-old white female who presents with her mother complaining of a four-day history of cold symptoms consisting of nasal congestion and left ear pain
360,1557,1291, A CAT scan of the abdomen and pelvis was obtained revealing findings consistent with acute appendicitis
361,1935,1474, Postpartum hemorrhage
362,1348,1183," Degenerative osteoarthritis of acromioclavicular joint, left shoulder, rule out slap lesion."
363,1014,983," Epidural steroid injection, epidurogram, fluroscopy - Low back pain, herniated disc, lumbosacral Facet, arthropathy."
364,805,842, This essentially excludes obstructive CAD as a cause of her elevated troponin.
365,3216,2331," The patient was referred for outpatient skilled speech therapy, secondary to right hemisphere disorder, status post stroke"
366,1816,1411,  Exploratory laparotomy and drainage of intra-abdominal abscesses with control of leakage
367,394,446,  He is not a candidate for chlorambucil or radioactive phosphorus because of his young age and the concern for secondary malignancy.
368,2672,1868, Fiberoptic bronchoscopy for diagnosis of right lung atelectasis and extensive mucus plugging in right main stem bronchus.
369,156,177," The patient is a 16-month-old boy, who had a circumcision performed approximately 4 days before he developed penile swelling and fever and discharge"
370,2688,1877," Left heart catheterization, left and right coronary angiography, left ventricular angiography, and intercoronary stenting of the right coronary artery."
371,3093,2245, A 23-year-old white female presents with complaint of allergies.
372,2153,1584, Acute gangrenous cholecystitis with cholelithiasis
373,3000,2172," School reports continuing difficulties with repetitive questioning, obsession with cleanness on a daily basis, concerned about his inability to relate this well in the classroom"
374,212,258, This is a 27-year-old female who presents with a couple of days history of some dental pain
375,3017,2180, She is a 79-year-old female who came in with acute cholecystitis and underwent attempted laparoscopic cholecystectomy 8 days ago
376,2813,1966, Symptoms are not accompanied by tinnitus or deafness
377,2831,1983, This 62-year-old white female has essential tremor and mild torticollis
378,3057,2212, The patient has recently had an admission for pneumonia with positive blood count
379,2883,2070, Right-sided abdominal pain with nausea and fever
380,1550,1287, There were particular changes on the serosal surface as well as on the mucosal surface with multiple clots within the gallbladder.
381,2531,1776, Patient with family history of colon cancer and has rectal bleeding on a weekly basis and also heartburn once every 1 or 2 weeks
382,213,258, She has had increasing swelling and pain to the left lower mandible area today.
383,3097,2250, A 47-year-old white female presents with concern about possible spider bite to the left side of her neck.
384,3029,2187, Sepsis due to urinary tract infection.
385,2950,2130, He has had no palpitations or lightheadedness
386,2606,1834, Laparoscopic cholecystectomy with attempted intraoperative cholangiogram
387,2077,1554, Symptomatic cholelithiasis
388,1252,1133, Central cord syndrome and acute quadriplegia.
389,238,300, Bladder instillation for chronic interstitial cystitis.
390,199,241," Cerebral palsy, worsening seizures"
391,3021,2180, She is tolerating her regular diet.
392,1380,1201," Cystoscopy, bilateral retrograde ureteropyelograms, right ureteral barbotage for urine cytology, and right ureterorenoscopy."
393,2894,2073," Mild biatrial enlargement, normal thickening of the left ventricle with mildly dilated ventricle and EF of 40%, mild mitral regurgitation, diastolic dysfunction grade 2, mild pulmonary hypertension."
394,994,967," Well developed, well nourished, in no acute distress."
395,461,505, Abnormal liver enzymes and diarrhea
396,2878,2068," Lower quadrant pain with nausea, vomiting, and diarrhea"
397,621,640, Cadaveric renal transplant to right pelvis - endstage renal disease.
398,422,475, Risk factors for coronary heart disease.
399,1099,1035,  Diffuse intestinal and mesenteric lymphangiectasia
400,2352,1674," Metastatic glossal carcinoma, needing chemotherapy and a port."
401,1004,976, The patient is a very nice patient with adenotonsillitis with hypertrophy and obstructive symptoms
402,3112,2265," Followup dietary consultation for hyperlipidemia, hypertension, and possible metabolic syndrome"
403,3026,2185," The patient did undergo echocardiogram, which shows aortic stenosis, severe"
404,2173,1593, Left excisional breast biopsy due to atypical ductal hyperplasia of left breast.
405,334,408, Her pregnancy is complicated by preterm contractions
406,2291,1647," Exploratory laparotomy, lysis of adhesions and removal, reversal of Hartmann's colostomy, flexible sigmoidoscopy, and cystoscopy with left ureteral stent."
407,221,270, Intracranial aneurysm.
408,1496,1260, The patient is a 5-year-old young man with fluid collection in the tunica vaginalis and peritesticular space on the left side consistent with a communicating hydrocele
409,1718,1366," Total cardiopulmonary bypass, cold-blood potassium cardioplegia, antegrade for myocardial protection."
410,625,645," This is a 53-year-old man, who presented to emergency room with multiple complaints including pain from his hernia, some question of blood in his stool, nausea, and vomiting, and also left lower extremity pain"
411,2919,2108," Congestive heart failure, stable on current regimen"
412,2833,1985, Genetic counseling for a strong family history of colon polyps
413,2402,1702," A 69-year-old man status post trauma, slightly prolonged respiratory failure status post tracheostomy, requires another bronchoscopy for further evaluation of refractory pneumonitis."
414,3055,2210," Comprehensive Evaluation - Generalized anxiety and hypertension, both under fair control."
415,1189,1099," A female presents 7 months status post spontaneous vaginal delivery, has had abnormal uterine bleeding since her delivery with an ultrasound showing a 6 cm x 6 cm fundal mass suspicious either for retained products or endometrial polyp."
416,1635,1327, A 21-year-old female was having severe cramping and was noted to have a blighted ovum with her first ultrasound in the office.
417,2519,1769, Mild diverticulosis of the sigmoid colon
418,3219,2334," Patient with a history of mesothelioma and likely mild dementia, most likely Alzheimer type."
419,971,949," Total cardiopulmonary bypass, cold-blood potassium cardioplegia, antegrade for myocardial protection"
420,919,917," EMG/Nerve Conduction Study showing sensory motor length-dependent neuropathy consistent with diabetes, severe left ulnar neuropathy, and moderate-to-severe left median neuropathy, "
421,3109,2262," Dietary consultation for hyperlipidemia, hypertension, gastroesophageal reflux disease and weight reduction."
422,318,400," A female with the past medical history of Ewing sarcoma, iron deficiency anemia, hypertension, and obesity."
423,233,288, The patient on recent followup cystoscopy for transitional cell carcinomas of the bladder neck was found to have a 5-cm area of papillomatosis just above the left ureteric orifice.
424,171,209, She underwent a bone marrow biopsy which showed a normal cellular marrow with trilineage hematopoiesis.
425,2383,1692,"  The patient had a history of peptic ulcer disease, epigastric abdominal pain x2 months, being evaluated at this time for ulcer disease."
426,978,954, The patient is a 52-year-old male who is here for independent medical evaluation.
427,1312,1166, Left facial cellulitis and possible odontogenic abscess
428,353,418," Extensive workup during her first hospitalization was all negative, but a prominent feature was her very blunted affect and real anhedonia."
429,1485,1255," Cystoscopy, transurethral resection of medium bladder tumor (4.0 cm in diameter), and direct bladder biopsy."
